drop table if exists t1;
DROP TABLE IF EXISTS t1;
SHOW COLLATION LIKE 'cp1250_czech_cs';
Collation	Charset	Id	Default	Compiled	Sortlen
cp1250_czech_cs	cp1250	34		Yes	2
CREATE TABLE t1 (a char(16)) character set cp1250 collate cp1250_czech_cs;
INSERT INTO t1 VALUES ('');
SELECT a, length(a), a='', a=' ', a='  ' FROM t1;
a	length(a)	a=''	a=' '	a='  '
	0	1	1	1
DROP TABLE t1;
CREATE TABLE t1 (
popisek varchar(30) collate cp1250_general_ci NOT NULL default '',
PRIMARY KEY  (`popisek`)
);
INSERT INTO t1 VALUES ('2005-01-1');
SELECT * FROM t1 WHERE popisek = '2005-01-1';
popisek
2005-01-1
SELECT * FROM t1 WHERE popisek LIKE '2005-01-1';
popisek
2005-01-1
drop table t1;
set names cp1250;
CREATE TABLE t1
(
id  INT AUTO_INCREMENT PRIMARY KEY,
str VARCHAR(32)  CHARACTER SET cp1250 COLLATE cp1250_czech_cs NOT NULL default '',
UNIQUE KEY (str)
);
INSERT INTO t1 VALUES (NULL, 'a');
INSERT INTO t1 VALUES (NULL, 'aa');
INSERT INTO t1 VALUES (NULL, 'aaa');
INSERT INTO t1 VALUES (NULL, 'aaaa');
INSERT INTO t1 VALUES (NULL, 'aaaaa');
INSERT INTO t1 VALUES (NULL, 'aaaaaa');
INSERT INTO t1 VALUES (NULL, 'aaaaaaa');
select * from t1 where str like 'aa%';
id	str
2	aa
3	aaa
4	aaaa
5	aaaaa
6	aaaaaa
7	aaaaaaa
drop table t1;
set names cp1250;
create table t1 (a varchar(15) collate cp1250_czech_cs NOT NULL, primary key(a));
insert into t1 values("abcdefgh·");
insert into t1 values("··ËË");
select a from t1 where a like "abcdefgh·";
a
abcdefgh·
drop table t1;
set names cp1250 collate cp1250_czech_cs;
SELECT strcmp('a','a ');
strcmp('a','a ')
0
SELECT strcmp('a\0','a' );
strcmp('a\0','a' )
-1
SELECT strcmp('a\0','a ');
strcmp('a\0','a ')
-1
SELECT strcmp('a\t','a' );
strcmp('a\t','a' )
-1
SELECT strcmp('a\t','a ');
strcmp('a\t','a ')
-1
create table t1 select repeat('a',4000) a;
delete from t1;
insert into t1 values ('a'), ('a '), ('a\t');
select collation(a),hex(a) from t1 order by a;
collation(a)	hex(a)
cp1250_czech_cs	6109
cp1250_czech_cs	61
cp1250_czech_cs	6120
drop table t1;
select @@collation_connection;
@@collation_connection
cp1250_czech_cs
select hex(weight_string('a'));
hex(weight_string('a'))
A402
select hex(weight_string('A'));
hex(weight_string('A'))
A401
select hex(weight_string('abc'));
hex(weight_string('abc'))
A4A5A6020202
select hex(weight_string('abc' as char(2)));
hex(weight_string('abc' as char(2)))
A4A50202
select hex(weight_string('abc' as char(3)));
hex(weight_string('abc' as char(3)))
A4A5A6020202
select hex(weight_string('abc' as char(5)));
hex(weight_string('abc' as char(5)))
A4A5A682820202020101
select @@collation_connection;
@@collation_connection
cp1250_czech_cs
select collation(cast(_latin1 0xDF as char));
collation(cast(_latin1 0xDF as char))
cp1250_czech_cs
select hex(weight_string('s'));
hex(weight_string('s'))
B902
select hex(weight_string(cast(_latin1 0xDF as char)));
hex(weight_string(cast(_latin1 0xDF as char)))
BB01
select hex(weight_string(cast(_latin1 0xDF as char) as char(1)));
hex(weight_string(cast(_latin1 0xDF as char) as char(1)))
BB01
select hex(weight_string('c'));
hex(weight_string('c'))
A602
select hex(weight_string('h'));
hex(weight_string('h'))
AC02
select hex(weight_string('ch'));
hex(weight_string('ch'))
AD03
select hex(weight_string('i'));
hex(weight_string('i'))
AE02
select hex(weight_string(cast(_latin1 0x6368DF as char)));
hex(weight_string(cast(_latin1 0x6368DF as char)))
ADBB0301
select hex(weight_string(cast(_latin1 0x6368DF as char) as char(1)));
hex(weight_string(cast(_latin1 0x6368DF as char) as char(1)))
AD03
select hex(weight_string(cast(_latin1 0x6368DF as char) as char(2)));
hex(weight_string(cast(_latin1 0x6368DF as char) as char(2)))
ADBB0301
select hex(weight_string(cast(_latin1 0x6368DF as char) as char(3)));
hex(weight_string(cast(_latin1 0x6368DF as char) as char(3)))
ADBB82030101
select hex(weight_string(cast(_latin1 0x6368DF as char) as char(4)));
hex(weight_string(cast(_latin1 0x6368DF as char) as char(4)))
ADBB828203010101
select hex(weight_string(cast(_latin1 0xDF6368 as char)));
hex(weight_string(cast(_latin1 0xDF6368 as char)))
BBAD0103
select hex(weight_string(cast(_latin1 0xDF6368 as char) as char(1)));
hex(weight_string(cast(_latin1 0xDF6368 as char) as char(1)))
BB01
select hex(weight_string(cast(_latin1 0xDF6368 as char) as char(2)));
hex(weight_string(cast(_latin1 0xDF6368 as char) as char(2)))
BBAD0103
select hex(weight_string(cast(_latin1 0xDF6368 as char) as char(3)));
hex(weight_string(cast(_latin1 0xDF6368 as char) as char(3)))
BBAD82010301
select hex(weight_string(cast(_latin1 0xDF6368 as char) as char(4)));
hex(weight_string(cast(_latin1 0xDF6368 as char) as char(4)))
BBAD828201030101
select @@collation_connection;
@@collation_connection
cp1250_czech_cs
select hex(weight_string('a' LEVEL 1));
hex(weight_string('a' LEVEL 1))
A4
select hex(weight_string('A' LEVEL 1));
hex(weight_string('A' LEVEL 1))
A4
select hex(weight_string('abc' LEVEL 1));
hex(weight_string('abc' LEVEL 1))
A4A5A6
select hex(weight_string('abc' as char(2) LEVEL 1));
hex(weight_string('abc' as char(2) LEVEL 1))
A4A5
select hex(weight_string('abc' as char(3) LEVEL 1));
hex(weight_string('abc' as char(3) LEVEL 1))
A4A5A6
select hex(weight_string('abc' as char(5) LEVEL 1));
hex(weight_string('abc' as char(5) LEVEL 1))
A4A5A68282
select hex(weight_string('abc' as char(5) LEVEL 1 REVERSE));
hex(weight_string('abc' as char(5) LEVEL 1 REVERSE))
8282A6A5A4
select hex(weight_string('abc' as char(5) LEVEL 1 DESC));
hex(weight_string('abc' as char(5) LEVEL 1 DESC))
5B5A597D7D
select hex(weight_string('abc' as char(5) LEVEL 1 DESC REVERSE));
hex(weight_string('abc' as char(5) LEVEL 1 DESC REVERSE))
7D7D595A5B
select @@collation_connection;
@@collation_connection
cp1250_czech_cs
select hex(weight_string('a' LEVEL 2));
hex(weight_string('a' LEVEL 2))
02
select hex(weight_string('A' LEVEL 2));
hex(weight_string('A' LEVEL 2))
01
select hex(weight_string('abc' LEVEL 2));
hex(weight_string('abc' LEVEL 2))
020202
select hex(weight_string('abc' as char(2) LEVEL 2));
hex(weight_string('abc' as char(2) LEVEL 2))
0202
select hex(weight_string('abc' as char(3) LEVEL 2));
hex(weight_string('abc' as char(3) LEVEL 2))
020202
select hex(weight_string('abc' as char(5) LEVEL 2));
hex(weight_string('abc' as char(5) LEVEL 2))
0202020101
select @@collation_connection;
@@collation_connection
cp1250_czech_cs
select hex(weight_string('a' LEVEL 1,2));
hex(weight_string('a' LEVEL 1,2))
A402
select hex(weight_string('a' LEVEL 1-2));
hex(weight_string('a' LEVEL 1-2))
A402
select hex(weight_string('A' LEVEL 1,2));
hex(weight_string('A' LEVEL 1,2))
A401
select hex(weight_string('A' LEVEL 1-2));
hex(weight_string('A' LEVEL 1-2))
A401
