drop table if exists t1;
create table t1 (a int, b varchar(64));
-- Load a static XML file
load xml infile '../std_data_ln/loadxml.dat' into table t1
rows identified by '<row>';
select * from t1 order by a;
a	b
1	b1
2	b2
3	b3
11	b11
111	b111
112	b112 & < > " ' &unknown; -- check entities
212	b212
delete from t1;
-- Load a static XML file with 'IGNORE num ROWS'
load xml infile '../std_data_ln/loadxml.dat' into table t1
rows identified by '<row>' ignore 4 rows;
select * from t1 order by a;
a	b
111	b111
112	b112 & < > " ' &unknown; -- check entities
212	b212
-- Check 'mysqldump --xml' + 'LOAD XML' round trip
delete from t1;
load xml infile 'MYSQL_TMP_DIR/loadxml-dump.xml' into table t1 rows identified by '<row>';;
select * from t1 order by a;
a	b
111	b111
112	b112 & < > " ' &unknown; -- check entities
212	b212
-- Check that 'xml' is not a keyword
select 1 as xml;
xml
1
drop table t1;
