*** Bug #32194 ***
SET @@storage_engine = Falcon;
DROP TABLE IF EXISTS t1;
CREATE TABLE t1 (s1 INT) engine=falcon;
INSERT INTO t1 VALUES (null),(null),(9);
SELECT * FROM t1;
s1
NULL
NULL
9
UPDATE t1 SET s1 = s1 + 1;
affected rows: 1
info: Rows matched: 3  Changed: 1  Warnings: 0
SELECT * FROM t1;
s1
NULL
NULL
10
DROP TABLE t1;
